<?xml version="1.0"?>
<!DOCTYPE Report
[
<!ELEMENT Report (General ,(Doc|BPT)) >
<!ATTLIST Report ver CDATA #REQUIRED tmZone CDATA #REQUIRED>

<!ELEMENT General ( DocLocation ) >
<!ATTLIST General productName CDATA #REQUIRED productVer CDATA #REQUIRED os CDATA #REQUIRED host CDATA #REQUIRED qcserver CDATA #IMPLIED qcproject CDATA #IMPLIED SolManSolutionId CDATA #IMPLIED SolManProjectId CDATA #IMPLIED SolManTestPlanId CDATA #IMPLIED SolManTestPackageId CDATA #IMPLIED SolManUserInfoData CDATA #IMPLIED  >

<!ELEMENT BPT (DName,Res,DVer?,TSet?,TInst?,NodeArgs,AdditionalInfo*,Doc*) >
<!ATTLIST BPT rID ID #REQUIRED >

<!ELEMENT Doc (DName,ConfName?,Res,DVer?,TSet?,TInst?,RunType?,DT?,AdditionalInfo*,Step*,DIter*,Step*,Action*,Doc*,Summary?,TestMaintenanceSummary*,NodeArgs?) >
<!ATTLIST Doc rID ID #REQUIRED type (Test|BC|BPTWrapperTest|Flow|Group|Action) "Test" productName CDATA #REQUIRED BCIter CDATA #IMPLIED >

<!ELEMENT RunType ( #PCDATA )>
<!ATTLIST RunType fmStep (False|True) "False" batch (False|True) "False" upDesc (False|True) "False" upChk (False|True) "False" upAS (False|True) "False">

<!ELEMENT DName ( #PCDATA ) >

<!ELEMENT ConfName ( #PCDATA ) >

<!ELEMENT Res ( #PCDATA ) >

<!ELEMENT AdditionalInfo (AdditionalDataName,AdditionalDataValue ) >

<!ELEMENT AdditionalDataName ( #PCDATA ) >

<!ELEMENT AdditionalDataValue ( #PCDATA ) >

<!ELEMENT DVer ( #PCDATA ) >

<!ELEMENT TSet ( #PCDATA ) >

<!ELEMENT TInst ( #PCDATA ) >

<!ELEMENT DIter (Step*,Action+,Summary?,NodeArgs)>
<!ATTLIST DIter rID ID #REQUIRED iterID CDATA #REQUIRED>

<!ELEMENT DocLocation ( #PCDATA )>

<!ELEMENT Action (AName,AIter*,(Step|HtmlStep|Action)*, Summary,ActionMaintenanceSummary*, NodeArgs ) >
<!ATTLIST Action rID ID #REQUIRED>

<!ELEMENT AIter ((Step|HtmlStep|Action)*,DataMapping?, Summary?,NodeArgs) >
<!ATTLIST AIter rID ID #REQUIRED iterID CDATA #REQUIRED isCountable (False|True) "False" >

<!ELEMENT AName ( #PCDATA ) >

<!ELEMENT TestMaintenanceSummary (ActionMaintenanceSummary*) >
<!ATTLIST TestMaintenanceSummary ObjectsAdded CDATA #REQUIRED ObjectsUpdated CDATA #REQUIRED StepsUpdated CDATA #REQUIRED StepsComments CDATA #REQUIRED><!ELEMENT ActionMaintenanceSummary (ObjectChange* ) >
<!ATTLIST ActionMaintenanceSummary Action CDATA #REQUIRED Objects CDATA #REQUIRED Updated CDATA #REQUIRED LinesTotal CDATA #REQUIRED Added CDATA #REQUIRED LinesUpdated CDATA #REQUIRED>

<!ELEMENT ObjectChange  (Hierarchy, PropertyChangeList* ) >
<!ATTLIST ObjectChange Operation CDATA #IMPLIED OriginalRepository CDATA #IMPLIED>

<!ELEMENT PropertyChangeList (PropertyDef*) >

<!ELEMENT PropertyDef (OriginalValue, NewValue) >
<!ATTLIST PropertyDef PropName CDATA #REQUIRED OriginRegularExpression (True|False) "False" NewRegularExpression (True|False) "False" AddedProperty (True|False) "False" >

<!ELEMENT OriginalValue ( #PCDATA )>

<!ELEMENT NewValue ( #PCDATA )>

<!ELEMENT Hierarchy  (ObjectName, Hierarchy*) >
<!ATTLIST Hierarchy MicClass CDATA #REQUIRED>

<!ELEMENT ObjectName  ( #PCDATA ) >

<!ELEMENT Step (Obj,Details,Time,TimeTick* ,(Step|HtmlStep|Doc)*, DataMapping?, NodeArgs) >
<!ATTLIST Step rID ID #REQUIRED retval CDATA #IMPLIED>

<!ELEMENT HtmlStep (HTML,TimeTick*,(Step|HtmlStep|Doc)*,NodeArgs) >
<!ATTLIST HtmlStep rID ID #REQUIRED >

<!ELEMENT Obj ( #PCDATA ) >
<!ATTLIST Obj plainTxt (False|True) "True">

<!ELEMENT Details ( #PCDATA ) >
<!ATTLIST Details plainTxt (False|True) "True">

<!ELEMENT Time ( #PCDATA ) >

<!ELEMENT HTML ( #PCDATA ) >

<!ELEMENT Disp ( #PCDATA ) >

<!ELEMENT TimeTick ( #PCDATA ) >

<!ELEMENT DataMapping ( DataMappedItem* )>
<!ELEMENT DataMappedItem EMPTY >
<!ATTLIST DataMappedItem dsName CDATA #REQUIRED >
<!ATTLIST DataMappedItem rowId CDATA #REQUIRED >

<!ELEMENT NodeArgs (Disp,TopPane?,BtmPane?,ExtendedInfo? )>
<!ATTLIST NodeArgs eType CDATA #REQUIRED icon CDATA #REQUIRED nRep CDATA #REQUIRED UserNote CDATA #IMPLIED filter (False|True) "True">
<!ATTLIST NodeArgs status (Passed|Failed|Done|Warning|Information) "Done">
<!ATTLIST NodeArgs iconSel CDATA #IMPLIED nType CDATA #IMPLIED MovieMarker CDATA "">
<!ATTLIST NodeArgs Source CDATA #IMPLIED SourceLine CDATA #IMPLIED StepFlowItemKey CDATA #IMPLIED >

<!ELEMENT TopPane (Path)>

<!ELEMENT BtmPane ( (Path|WR)?,ASHilite?)>
<!ATTLIST BtmPane vType CDATA "HTML">

<!ELEMENT Path ( #PCDATA ) >

<!ELEMENT ASHilite ( #PCDATA ) >

<!ELEMENT WR ( #PCDATA ) >

<!ELEMENT ExtendedInfo ( StepData ) >

<!ATTLIST ExtendedInfo StepType CDATA #REQUIRED>
<!ELEMENT DT (NodeArgs) >
<!ATTLIST DT rID ID #REQUIRED>

<!ELEMENT Summary (Param*)>
<!ATTLIST Summary sTime CDATA #IMPLIED eTime CDATA #IMPLIED passed CDATA #IMPLIED failed CDATA #IMPLIED warnings CDATA #IMPLIED retval CDATA #IMPLIED stopped (False|True) "False" >

<!ELEMENT Param (ParamName,ParamVal)+ >
<!ATTLIST Param paramInOut (In|Out) "In">

<!ELEMENT ParamName ( #PCDATA ) >

<!ELEMENT ParamVal ( #PCDATA ) >

]
>
<Report ver="2.0" tmZone="India Standard Time">
<General productName="HPE Unified Functional Testing" productVer="14.03" os="" host="LIN33004137"><DocLocation><![CDATA[C:\framework\QTP-Hybrid-Framework\QTP-Hybrid-Framework\TestCases\orangehrm_11]]></DocLocation></General>
<Doc rID="T1"   productName= "HPE Unified Functional Testing"  >
<DName><![CDATA[orangehrm_11]]></DName>
<Res><![CDATA[Res31]]></Res>
<DT rID="T2">
<NodeArgs eType="Table" icon="2" nRep="4" filter="False" >
<Disp><![CDATA[Run-Time Data Table]]></Disp>
<BtmPane vType="Table" >
<Path><![CDATA[Default.xls]]></Path>
</BtmPane>
</NodeArgs>
</DT>
<DIter rID="T3" iterID="1" >
<Step rID="T4">
<Obj plainTxt="False" ><![CDATA[StartUp Browser]]></Obj>
<Details plainTxt="False" ><![CDATA[<table><tr><td><span style="text-align : left; font-size : 12px; ">Local Browser</span></td></tr></table>]]></Details>
<Time><![CDATA[14-02-2023 - 13:38:57]]></Time>
<TimeTick>1676362137</TimeTick>
<Step rID="T5">
<Obj plainTxt="False" ><![CDATA[StartUp Browser.Navigate]]></Obj>
<Details plainTxt="False" ><![CDATA[Navigate to https://opensource-demo.orangehrmlive.com/web/index.php/auth/login]]></Details>
<Time><![CDATA[14-02-2023 - 13:38:57]]></Time>
<TimeTick>1676362137</TimeTick>
<NodeArgs eType="Replay" icon="4" nRep="9" Source="Action0" SourceLine="-1" >
<Disp><![CDATA[StartUp Browser.Navigate]]></Disp>
</NodeArgs>
</Step>
<Step rID="T6">
<Obj plainTxt="False" ><![CDATA[StartUp Browser.Sync]]></Obj>
<Details plainTxt="False" ><![CDATA[]]></Details>
<Time><![CDATA[14-02-2023 - 13:38:58]]></Time>
<TimeTick>1676362138</TimeTick>
<NodeArgs eType="Replay" icon="4" nRep="11" Source="Action0" SourceLine="-1" >
<Disp><![CDATA[StartUp Browser.Sync]]></Disp>
</NodeArgs>
</Step>
<NodeArgs eType="Context" icon="4" nRep="8" Source="Action0" SourceLine="-1" >
<Disp><![CDATA[StartUp Browser]]></Disp>
</NodeArgs>
</Step>
<Action rID="T7">
<AName><![CDATA[Login]]></AName>
<Step rID="T8">
<Obj plainTxt="False" ><![CDATA[OrangeHRM]]></Obj>
<Details plainTxt="False" ><![CDATA[<table><tr><td><span style="text-align : left; font-size : 12px; ">Local Browser</span></td></tr></table>]]></Details>
<Time><![CDATA[14-02-2023 - 13:39:02]]></Time>
<TimeTick>1676362142</TimeTick>
<Step rID="T9">
<Obj plainTxt="False" ><![CDATA[OrangeHRM]]></Obj>
<Details plainTxt="False" ><![CDATA[Page]]></Details>
<Time><![CDATA[14-02-2023 - 13:39:02]]></Time>
<TimeTick>1676362142</TimeTick>
<Step rID="T10">
<Obj plainTxt="False" ><![CDATA[username.Set]]></Obj>
<Details plainTxt="False" ><![CDATA["Admin"]]></Details>
<Time><![CDATA[14-02-2023 - 13:39:02]]></Time>
<TimeTick>1676362142</TimeTick>
<NodeArgs eType="Replay" icon="7" nRep="24" >
<Disp><![CDATA[username.Set]]></Disp>
</NodeArgs>
</Step>
<Step rID="T11">
<Obj plainTxt="False" ><![CDATA[password.Set]]></Obj>
<Details plainTxt="False" ><![CDATA["63eb2d5da7b3959dae3c5969ba13413df5b4cf4a242b"]]></Details>
<Time><![CDATA[14-02-2023 - 13:39:02]]></Time>
<TimeTick>1676362142</TimeTick>
<NodeArgs eType="Replay" icon="7" nRep="27" >
<Disp><![CDATA[password.Set]]></Disp>
</NodeArgs>
</Step>
<Step rID="T12">
<Obj plainTxt="False" ><![CDATA[Login.Click]]></Obj>
<Details plainTxt="False" ><![CDATA[]]></Details>
<Time><![CDATA[14-02-2023 - 13:39:02]]></Time>
<TimeTick>1676362142</TimeTick>
<NodeArgs eType="Replay" icon="8" nRep="30" >
<Disp><![CDATA[Login.Click]]></Disp>
</NodeArgs>
</Step>
<NodeArgs eType="Context" icon="6" nRep="23" >
<Disp><![CDATA[OrangeHRM]]></Disp>
</NodeArgs>
</Step>
<NodeArgs eType="Context" icon="4" nRep="22" >
<Disp><![CDATA[OrangeHRM]]></Disp>
</NodeArgs>
</Step>
<Summary sTime="14-02-2023 - 13:38:58" eTime="14-02-2023 - 13:39:02" passed="0" failed="0" warnings="0" ></Summary>
<NodeArgs eType="StartAction" icon="5" nRep="12" >
<Disp><![CDATA[Login Summary]]></Disp>
</NodeArgs>
</Action>
<Action rID="T13">
<AName><![CDATA[pim]]></AName>
<Step rID="T14">
<Obj plainTxt="False" ><![CDATA[OrangeHRM]]></Obj>
<Details plainTxt="False" ><![CDATA[<table><tr><td><span style="text-align : left; font-size : 12px; ">Local Browser</span></td></tr></table>]]></Details>
<Time><![CDATA[14-02-2023 - 13:39:04]]></Time>
<TimeTick>1676362144</TimeTick>
<Step rID="T15">
<Obj plainTxt="False" ><![CDATA[OrangeHRM_9]]></Obj>
<Details plainTxt="False" ><![CDATA[Page]]></Details>
<Time><![CDATA[14-02-2023 - 13:39:04]]></Time>
<TimeTick>1676362144</TimeTick>
<Step rID="T16">
<Obj plainTxt="False" ><![CDATA[PIM.Click]]></Obj>
<Details plainTxt="False" ><![CDATA[]]></Details>
<Time><![CDATA[14-02-2023 - 13:39:04]]></Time>
<TimeTick>1676362144</TimeTick>
<NodeArgs eType="Replay" icon="9" nRep="37" >
<Disp><![CDATA[PIM.Click]]></Disp>
</NodeArgs>
</Step>
<NodeArgs eType="Context" icon="6" nRep="36" >
<Disp><![CDATA[OrangeHRM_9]]></Disp>
</NodeArgs>
</Step>
<Step rID="T17">
<Obj plainTxt="False" ><![CDATA[OrangeHRM_2]]></Obj>
<Details plainTxt="False" ><![CDATA[Page]]></Details>
<Time><![CDATA[14-02-2023 - 13:39:06]]></Time>
<TimeTick>1676362146</TimeTick>
<Step rID="T18">
<Obj plainTxt="False" ><![CDATA[Type for hints....Set]]></Obj>
<Details plainTxt="False" ><![CDATA["madhu"]]></Details>
<Time><![CDATA[14-02-2023 - 13:39:06]]></Time>
<TimeTick>1676362146</TimeTick>
<NodeArgs eType="Replay" icon="7" nRep="45" >
<Disp><![CDATA[Type for hints....Set]]></Disp>
</NodeArgs>
</Step>
<Step rID="T19">
<Obj plainTxt="False" ><![CDATA[Search.Click]]></Obj>
<Details plainTxt="False" ><![CDATA[]]></Details>
<Time><![CDATA[14-02-2023 - 13:39:06]]></Time>
<TimeTick>1676362146</TimeTick>
<NodeArgs eType="Replay" icon="8" nRep="48" >
<Disp><![CDATA[Search.Click]]></Disp>
</NodeArgs>
</Step>
<Step rID="T20">
<Obj plainTxt="False" ><![CDATA[Add.Click]]></Obj>
<Details plainTxt="False" ><![CDATA[]]></Details>
<Time><![CDATA[14-02-2023 - 13:39:06]]></Time>
<TimeTick>1676362146</TimeTick>
<NodeArgs eType="Replay" icon="8" nRep="51" >
<Disp><![CDATA[Add.Click]]></Disp>
</NodeArgs>
</Step>
<NodeArgs eType="Context" icon="6" nRep="44" >
<Disp><![CDATA[OrangeHRM_2]]></Disp>
</NodeArgs>
</Step>
<Step rID="T21">
<Obj plainTxt="False" ><![CDATA[OrangeHRM_3]]></Obj>
<Details plainTxt="False" ><![CDATA[Page]]></Details>
<Time><![CDATA[14-02-2023 - 13:39:08]]></Time>
<TimeTick>1676362148</TimeTick>
<Step rID="T22">
<Obj plainTxt="False" ><![CDATA[firstName.Set]]></Obj>
<Details plainTxt="False" ><![CDATA["madhu"]]></Details>
<Time><![CDATA[14-02-2023 - 13:39:08]]></Time>
<TimeTick>1676362148</TimeTick>
<NodeArgs eType="Replay" icon="7" nRep="57" >
<Disp><![CDATA[firstName.Set]]></Disp>
</NodeArgs>
</Step>
<Step rID="T23">
<Obj plainTxt="False" ><![CDATA[lastName.Set]]></Obj>
<Details plainTxt="False" ><![CDATA["mamidela"]]></Details>
<Time><![CDATA[14-02-2023 - 13:39:08]]></Time>
<TimeTick>1676362148</TimeTick>
<NodeArgs eType="Replay" icon="7" nRep="60" >
<Disp><![CDATA[lastName.Set]]></Disp>
</NodeArgs>
</Step>
<Step rID="T24">
<Obj plainTxt="False" ><![CDATA[Save.Click]]></Obj>
<Details plainTxt="False" ><![CDATA[]]></Details>
<Time><![CDATA[14-02-2023 - 13:39:08]]></Time>
<TimeTick>1676362148</TimeTick>
<NodeArgs eType="Replay" icon="8" nRep="63" >
<Disp><![CDATA[Save.Click]]></Disp>
</NodeArgs>
</Step>
<NodeArgs eType="Context" icon="6" nRep="56" >
<Disp><![CDATA[OrangeHRM_3]]></Disp>
</NodeArgs>
</Step>
<Step rID="T25">
<Obj plainTxt="False" ><![CDATA[OrangeHRM_10]]></Obj>
<Details plainTxt="False" ><![CDATA[Page]]></Details>
<Time><![CDATA[14-02-2023 - 13:39:08]]></Time>
<TimeTick>1676362148</TimeTick>
<Step rID="T26">
<Obj plainTxt="False" ><![CDATA[Save.Click]]></Obj>
<Details plainTxt="False" ><![CDATA[]]></Details>
<Time><![CDATA[14-02-2023 - 13:39:08]]></Time>
<TimeTick>1676362148</TimeTick>
<NodeArgs eType="Replay" icon="8" nRep="67" >
<Disp><![CDATA[Save.Click]]></Disp>
</NodeArgs>
</Step>
<Step rID="T27">
<Obj plainTxt="False" ><![CDATA[Save_2.Click]]></Obj>
<Details plainTxt="False" ><![CDATA[]]></Details>
<Time><![CDATA[14-02-2023 - 13:39:08]]></Time>
<TimeTick>1676362148</TimeTick>
<NodeArgs eType="Replay" icon="8" nRep="70" >
<Disp><![CDATA[Save_2.Click]]></Disp>
</NodeArgs>
</Step>
<Step rID="T28">
<Obj plainTxt="False" ><![CDATA[PIM.Click]]></Obj>
<Details plainTxt="False" ><![CDATA[]]></Details>
<Time><![CDATA[14-02-2023 - 13:39:08]]></Time>
<TimeTick>1676362148</TimeTick>
<NodeArgs eType="Replay" icon="9" nRep="73" >
<Disp><![CDATA[PIM.Click]]></Disp>
</NodeArgs>
</Step>
<NodeArgs eType="Context" icon="6" nRep="66" >
<Disp><![CDATA[OrangeHRM_10]]></Disp>
</NodeArgs>
</Step>
<Step rID="T29">
<Obj plainTxt="False" ><![CDATA[OrangeHRM_2]]></Obj>
<Details plainTxt="False" ><![CDATA[Page]]></Details>
<Time><![CDATA[14-02-2023 - 13:39:11]]></Time>
<TimeTick>1676362151</TimeTick>
<Step rID="T30">
<Obj plainTxt="False" ><![CDATA[Type for hints....Set]]></Obj>
<Details plainTxt="False" ><![CDATA["madhu"]]></Details>
<Time><![CDATA[14-02-2023 - 13:39:11]]></Time>
<TimeTick>1676362151</TimeTick>
<NodeArgs eType="Replay" icon="7" nRep="78" >
<Disp><![CDATA[Type for hints....Set]]></Disp>
</NodeArgs>
</Step>
<Step rID="T31">
<Obj plainTxt="False" ><![CDATA[Search.Click]]></Obj>
<Details plainTxt="False" ><![CDATA[]]></Details>
<Time><![CDATA[14-02-2023 - 13:39:11]]></Time>
<TimeTick>1676362151</TimeTick>
<NodeArgs eType="Replay" icon="8" nRep="81" >
<Disp><![CDATA[Search.Click]]></Disp>
</NodeArgs>
</Step>
<Step rID="T32">
<Obj plainTxt="False" ><![CDATA[WebCheckBox.Set]]></Obj>
<Details plainTxt="False" ><![CDATA["ON"]]></Details>
<Time><![CDATA[14-02-2023 - 13:39:11]]></Time>
<TimeTick>1676362151</TimeTick>
<NodeArgs eType="Replay" icon="10" nRep="85" >
<Disp><![CDATA[WebCheckBox.Set]]></Disp>
</NodeArgs>
</Step>
<NodeArgs eType="Context" icon="6" nRep="77" >
<Disp><![CDATA[OrangeHRM_2]]></Disp>
</NodeArgs>
</Step>
<NodeArgs eType="Context" icon="4" nRep="35" >
<Disp><![CDATA[OrangeHRM]]></Disp>
</NodeArgs>
</Step>
<Summary sTime="14-02-2023 - 13:39:02" eTime="14-02-2023 - 13:39:11" passed="0" failed="0" warnings="0" ></Summary>
<NodeArgs eType="StartAction" icon="5" nRep="32" >
<Disp><![CDATA[pim Summary]]></Disp>
</NodeArgs>
</Action>
<Action rID="T33">
<AName><![CDATA[myingo]]></AName>
<Step rID="T34">
<Obj plainTxt="False" ><![CDATA[OrangeHRM]]></Obj>
<Details plainTxt="False" ><![CDATA[<table><tr><td><span style="text-align : left; font-size : 12px; ">Local Browser</span></td></tr></table>]]></Details>
<Time><![CDATA[14-02-2023 - 13:39:11]]></Time>
<TimeTick>1676362151</TimeTick>
<Step rID="T35">
<Obj plainTxt="False" ><![CDATA[OrangeHRM]]></Obj>
<Details plainTxt="False" ><![CDATA[Page]]></Details>
<Time><![CDATA[14-02-2023 - 13:39:11]]></Time>
<TimeTick>1676362151</TimeTick>
<Step rID="T36">
<Obj plainTxt="False" ><![CDATA[My Info.Click]]></Obj>
<Details plainTxt="False" ><![CDATA[]]></Details>
<Time><![CDATA[14-02-2023 - 13:39:11]]></Time>
<TimeTick>1676362151</TimeTick>
<NodeArgs eType="Replay" icon="9" nRep="92" >
<Disp><![CDATA[My Info.Click]]></Disp>
</NodeArgs>
</Step>
<Step rID="T37">
<Obj plainTxt="False" ><![CDATA[My Info.Click]]></Obj>
<Details plainTxt="False" ><![CDATA[]]></Details>
<Time><![CDATA[14-02-2023 - 13:39:13]]></Time>
<TimeTick>1676362153</TimeTick>
<NodeArgs eType="Replay" icon="9" nRep="95" >
<Disp><![CDATA[My Info.Click]]></Disp>
</NodeArgs>
</Step>
<Step rID="T38">
<Obj plainTxt="False" ><![CDATA[Save.Click]]></Obj>
<Details plainTxt="False" ><![CDATA[]]></Details>
<Time><![CDATA[14-02-2023 - 13:39:15]]></Time>
<TimeTick>1676362155</TimeTick>
<NodeArgs eType="Replay" icon="8" nRep="99" >
<Disp><![CDATA[Save.Click]]></Disp>
</NodeArgs>
</Step>
<Step rID="T39">
<Obj plainTxt="False" ><![CDATA[Save_2.Click]]></Obj>
<Details plainTxt="False" ><![CDATA[]]></Details>
<Time><![CDATA[14-02-2023 - 13:39:16]]></Time>
<TimeTick>1676362156</TimeTick>
<NodeArgs eType="Replay" icon="8" nRep="102" >
<Disp><![CDATA[Save_2.Click]]></Disp>
</NodeArgs>
</Step>
<Step rID="T40">
<Obj plainTxt="False" ><![CDATA["vishal Bhattaraimohan"- Description mismatch]]></Obj>
<Details plainTxt="False" ><![CDATA[The object was not found using the test object description. Check the object's properties.]]></Details>
<Time><![CDATA[14-02-2023 - 13:39:36]]></Time>
<TimeTick>1676362176</TimeTick>
<NodeArgs eType="Replay" icon="11" nRep="145" status="Warning" >
<Disp><![CDATA["vishal Bhattaraimohan"- Description mismatch]]></Disp>
</NodeArgs>
</Step>
<Step rID="T41">
<Obj plainTxt="False" ><![CDATA["vishal Bhattaraimohan"- Smart Identification]]></Obj>
<Details plainTxt="False" ><![CDATA[<P><span class="text">The smart identification mechanism was invoked.</span></P><P><SPAN class=text>Reason: object not found.</SPAN></P>           <SPAN class=text><b>Original description:</b></SPAN><br>micclass=WebElement<br>innertext=vishal Bhattaraimohan<br>html tag=SPAN<br><P><FONT face=Verdana size=2><SPAN class=text><B>Smart Identification Alternative Description: </B></SPAN></FONT></P><FONT face=Verdana size=2><u>Base filter properties (18 objects found)&nbsp;</FONT></u><br>
micclass=WebElement<br>html tag=SPAN<br><br><FONT face=Verdana size=2><u>Optional filter properties</FONT></u><br>
html id=<SPAN class=passed> (Used</SPAN>, 18 matches)</SPAN><br>class=oxd-userdropdown-tab<SPAN class=passed> (Used</SPAN>, 1 matches)</SPAN><br>innertext=vishal Bhattaraimohan<SPAN class=warning> (Ignored)<FONT color=#000000></FONT></SPAN><br>visible=-1<SPAN class=warning> (Ignored)<FONT color=#000000></FONT></SPAN><br>acc_name=<SPAN class=warning> (Ignored)<FONT color=#000000></FONT></SPAN><br>]]></Details>
<Time><![CDATA[14-02-2023 - 13:39:36]]></Time>
<TimeTick>1676362176</TimeTick>
<NodeArgs eType="Replay" icon="12" nRep="146" >
<Disp><![CDATA["vishal Bhattaraimohan"- Smart Identification]]></Disp>
</NodeArgs>
</Step>
<Step rID="T42">
<Obj plainTxt="False" ><![CDATA[vishal Bhattaraimohan.Click]]></Obj>
<Details plainTxt="False" ><![CDATA[]]></Details>
<Time><![CDATA[14-02-2023 - 13:39:36]]></Time>
<TimeTick>1676362176</TimeTick>
<NodeArgs eType="Replay" icon="11" nRep="147" >
<Disp><![CDATA[vishal Bhattaraimohan.Click]]></Disp>
</NodeArgs>
</Step>
<Step rID="T43">
<Obj plainTxt="False" ><![CDATA[About Support Change Password.Select]]></Obj>
<Details plainTxt="False" ><![CDATA["Logout"]]></Details>
<Time><![CDATA[14-02-2023 - 13:39:36]]></Time>
<TimeTick>1676362176</TimeTick>
<NodeArgs eType="Replay" icon="13" nRep="150" >
<Disp><![CDATA[About Support Change Password.Select]]></Disp>
</NodeArgs>
</Step>
<NodeArgs eType="Context" icon="6" nRep="91" status="Warning" >
<Disp><![CDATA[OrangeHRM]]></Disp>
</NodeArgs>
</Step>
<NodeArgs eType="Context" icon="4" nRep="90" status="Warning" >
<Disp><![CDATA[OrangeHRM]]></Disp>
</NodeArgs>
</Step>
<Summary sTime="14-02-2023 - 13:39:11" eTime="14-02-2023 - 13:39:36" passed="0" failed="0" warnings="1" ></Summary>
<NodeArgs eType="StartAction" icon="5" nRep="87" status="Warning" >
<Disp><![CDATA[myingo Summary]]></Disp>
</NodeArgs>
</Action>
<NodeArgs eType="StartIteration" icon="3" nRep="6" status="Warning" >
<Disp><![CDATA[orangehrm_11 Iteration 1 (Row 1)]]></Disp>
</NodeArgs>
</DIter>
<Summary sTime="14-02-2023 - 13:38:56" eTime="14-02-2023 - 13:39:37" passed="0" failed="0" warnings="1" ></Summary>
<NodeArgs eType="StartTest" icon="1" nRep="3" status="Warning" >
<Disp><![CDATA[Test orangehrm_11 Summary]]></Disp>
</NodeArgs>
</Doc>
</Report>